Merchant.Lat,Merchant.Lng,mean_preparing_time,std_preparing_time,MerchantName,FoodCategories,num_job,num_job_per_sec
13.8283918,100.5527541,955.433628318584,300.2755335309185,ร้านเชิญมาลองอาหารตามสั่ง,อาหารตามสั่ง,113,9.341931216931216e-05
13.8264589,100.5649431,860.9795918367347,351.3901541020087,ร้านเตยหอม กะเพราไส้แตก,อาหารตามสั่ง,49,4.050925925925926e-05
13.8270341,100.5645341,974.952380952381,287.02040348752314,ร้านเม้งเป็ดย่างสาขา2,อาหารตามสั่ง,42,3.472222222222222e-05
13.8270341,100.5645341,1058.698113207547,320.2634284168982,ร้านเลี่ยงเมืองปลาเผา,อาหารอีสาน,53,4.381613756613756e-05
13.8270341,100.5645341,863.2745098039215,341.81333504840995,ร้านเอเกมส์,อาหารตามสั่ง,51,4.216269841269841e-05
13.8246205,100.5633957,854.8478260869565,313.4459226219374,ร้านเฮียแจ๊คอาหารตามสั่ง หน้าSCB,อาหารตามสั่ง,46,3.8029100529100525e-05
13.8246205,100.5633957,897.3617021276596,294.7356858114059,ร้านแกงใต้เมืองตรัง,อาหารใต้,47,3.885582010582011e-05
13.8270341,100.5645341,967.2608695652174,304.01976729086493,ร้านแควน้อย,อาหารตามสั่ง,46,3.8029100529100525e-05
13.8263075,100.5738629,1195.75,319.74837111912444,ร้านแซนวิชประตูเขียว,Quick Meal,48,3.968253968253968e-05
13.8221346,100.5793754,1349.452380952381,344.65007805577943,ร้านแซ่บอีหลี Zab E Lee,อาหารอีสาน,42,3.472222222222222e-05
13.8303373,100.5471685,1182.9333333333334,337.69008803273385,ร้านโกดัง2020,อาหารตามสั่ง,45,3.7202380952380956e-05
13.8270341,100.5645341,948.7454545454544,302.9795803609585,ร้านโตโต้ ตำแหลก,อาหารอีสาน,55,4.546957671957672e-05
13.8270341,100.5645341,948.7142857142856,363.2190546111989,ร้านโย,อาหารตามสั่ง,49,4.050925925925926e-05
13.8270341,100.5645341,903.18,322.902566728727,ร้านในฝัน,อาหารตามสั่ง,50,4.1335978835978834e-05
13.8203651,100.5630145,924.6206896551724,297.1062057631457,ร้านใบตอง,อาหารตามสั่ง,58,4.794973544973546e-05
13.8246205,100.5633957,891.4418604651163,294.58818731946224,ร้านใบตองก๋วยเตี๋ยวหมูน้ำตก,ร้านก๋วยเตี๋ยว,43,3.55489417989418e-05
13.8270341,100.5645341,945.40350877193,282.77676147412427,ร้านใบเตย,อาหารตามสั่ง,57,4.712301587301587e-05
13.8262162,100.570517,987.2820512820512,338.1977837891532,ร้านไก่ลมโชยเมี่ยงปลาเผารัชดา44,อาหารอีสาน,39,3.224206349206349e-05
13.8239427,100.566485,918.6833333333332,323.20243871123387,ลาบเป็ดอุดร พหลโยธิน24,อาหารอีสาน,60,4.9603174603174596e-05
13.8246205,100.5633957,817.6170212765958,282.1046699660591,วอพเฟอร์เบลเยี่ยม กทม ร้านขายวอพเฟอร์,ของหวาน,47,3.885582010582011e-05
13.8270341,100.5645341,912.1875,398.2297105236499,วันดี,อาหารตามสั่ง,48,3.968253968253968e-05
13.8228114,100.5654557,881.4634146341464,304.7884590319522,สมตำคุณชาย,อาหารอีสาน,41,3.3895502645502647e-05
13.8245607,100.5642677,870.4054054054054,311.0423156629074,สมาคมส่งเสริมร้านอาหารแฟรนไชส์ไทย-เมียนมาร์,อาหารตามสั่ง,37,3.058862433862434e-05
13.8246205,100.5633957,966.7391304347826,327.7921819625441,สหชัยบะหมี่เกี๊ยวปูหมูแดง ร้านก๊วยเตี๊ยว,ร้านก๋วยเตี๋ยว,46,3.8029100529100525e-05
13.8374458,100.5405386,1390.483870967742,325.5884866562086,ส้มตำ ไก่ย่าง ประชาชื่น 34,อาหารอีสาน,31,2.562830687830688e-05
13.8246205,100.5633957,886.0408163265306,327.6231009761234,หมึกย่างแม่ไก่ ร้านขายปลาหมึก กทม,อาหารทะเล,49,4.050925925925926e-05
13.8218898,100.5804156,1371.4583333333333,382.1682089480436,หม่อง,อาหารตามสั่ง,48,3.968253968253968e-05
13.8270341,100.5645341,972.9591836734694,328.8751366048893,หม่าล่า,อาหารจานด่วน,49,4.050925925925926e-05
13.8270341,100.5645341,953.1111111111112,294.25168533245085,หอม,อาหารตามสั่ง,45,3.7202380952380956e-05
13.8363066,100.5505987,1079.9268292682927,346.92379076284686,ห้างหุ้นส่วนจำกัด ปัญญาซีฟู๊ด,อาหารทะเล,41,3.3895502645502647e-05
13.8242611,100.5620061,836.14,291.2522624804827,องค์ชายน้อยหมูนุ่ม หมูกรอบ,อาหารตามสั่ง,50,4.1335978835978834e-05
13.8243993,100.5729662,1095.925925925926,345.0217304939379,อาหารตามสั่ง by พี่ลูกกอล์ฟ,อาหารตามสั่ง,54,4.464285714285714e-05
13.8208651,100.5558353,958.603448275862,305.18659863779965,อาหารตามสั่ง ซอยวิภาวดีรังสิต 11,อาหารตามสั่ง,58,4.794973544973546e-05
13.8270341,100.5645341,893.6590909090909,328.65317054345377,อาหารตามสั่งอิสานอินดี้,อาหารอีสาน,44,3.637566137566137e-05
13.8270341,100.5645341,938.1224489795918,362.38673854261486,อาหารตามสั้ง,อาหารตามสั่ง,49,4.050925925925926e-05
13.8270341,100.5645341,953.1777777777778,343.2251796570544,อาหารอิสลามฮัยดัร,อาหารฮาลาล,45,3.7202380952380956e-05
13.8246205,100.5633957,992.68,296.78904561994875,อาหารเจ แตะสุข,อาหารตามสั่ง,50,4.1335978835978834e-05
13.8233015,100.559162,798.7096774193549,363.48787028157,อิราชัยมาเสะ,อาหารตามสั่ง,31,2.562830687830688e-05
13.826328,100.5650184,900.5961538461538,340.4305113560331,เจ็กหมีราดหน้า,ร้านก๋วยเตี๋ยว,52,4.298941798941799e-05
13.8254703,100.5592021,976.5471698113208,294.77094183851875,เตี๋ยวร้านต็อบ,ร้านก๋วยเตี๋ยว,53,4.381613756613756e-05
13.8270341,100.5645341,930.948717948718,300.2661169028148,เต็มอิ่ม,อาหารตามสั่ง,39,3.224206349206349e-05
13.8270089,100.5650812,972.7,324.5523224381548,เสน่ห์สุรินทร์ หอมกลิ่นสุราษฎร์,อาหารตามสั่ง,40,3.306878306878307e-05
13.8270341,100.5645341,1020.3414634146342,311.9733110658196,เหมยอาหารตามสั่ง,อาหารตามสั่ง,41,3.3895502645502647e-05
13.82572,100.5553484,888.8936170212766,327.6331130514256,แกงไท วิภาวดี17,อาหารตามสั่ง,47,3.885582010582011e-05
13.8306088,100.5435153,1051.0,324.479958153417,แซบนัว ครัวอิสาน สาขาประชานุกุล,อาหารอีสาน,37,3.058862433862434e-05
13.8238159,100.5664789,1008.6458333333334,350.2046716792513,แซ่บอีสาน,อาหารอีสาน,48,3.968253968253968e-05
13.8270341,100.5645341,989.6590909090908,252.69960096218253,โคลเวอร์ เฮ้าส์ พีพี,อาหารตามสั่ง,44,3.637566137566137e-05
13.8401929,100.5483621,1210.2444444444443,350.3674360538,โจ๊กลุง​ต๊อก​,อาหารตามสั่ง,45,3.7202380952380956e-05
13.8270341,100.5645341,900.14,295.5571694275069,โซลคุง,อาหารตามสั่ง,50,4.1335978835978834e-05
13.8272046,100.536048,1236.4318181818182,372.87899558870254,ไก่ย่างห้าดาว กรุงเทพ-นนท์44,Fast Food,44,3.637566137566137e-05
